{
  "run_id": "2026-06-21-phase-4-async-substrate-closure",
  "generated_at": "2026-06-21T03:30:03Z",
  "consumed_jobs": [
    "phase4-substrate-smoke"
  ],
  "succeeded_jobs": [
    "phase4-substrate-smoke"
  ],
  "failed_jobs": [],
  "timeout_jobs": [],
  "cancelled_jobs": [],
  "incomplete_jobs": [],
  "findings": [],
  "conflicts": [],
  "recommended_transition": null,
  "residual_risks": [
    "No live async worker supervision was exercised."
  ]
}
