{
  "run_id": "2026-06-22-phase-6-scheduler-watch-mode",
  "generated_at": "2026-06-22T05:23:27Z",
  "consumed_jobs": [
    "phase6-watch-agent"
  ],
  "succeeded_jobs": [
    "phase6-watch-agent"
  ],
  "failed_jobs": [],
  "timeout_jobs": [],
  "cancelled_jobs": [],
  "incomplete_jobs": [],
  "findings": [],
  "conflicts": [],
  "recommended_transition": null,
  "residual_risks": [
    "Heartbeat observational only",
    "Stop cooperative and does not interrupt running jobs",
    "Double-claim risk remains"
  ]
}
